{
  "version": "0.4",
  "canvas": {
    "width": 1632,
    "height": 720
  },
  "style": "openai-minimal",
  "title": {
    "text": "Evaluation Pipeline",
    "subtitle": "prompts, candidates, judges, and release reports"
  },
  "motion": {
    "profile": "showcase-v1",
    "sequence": "staged",
    "ease": "spring",
    "stagger": 0.12,
    "duration_scale": 1.0,
    "intensity": 1.0,
    "edge": {
      "preset": "packet-flow"
    },
    "node": {
      "preset": "icon-performance"
    },
    "group": {
      "preset": "border-scan"
    },
    "title": {
      "preset": "highlight-sweep"
    },
    "reduced_motion": "subtle"
  },
  "groups": [
    {
      "id": "eval",
      "label": "Eval Harness",
      "bounds": [
        94,
        250,
        1362,
        185
      ],
      "role": "neutral"
    }
  ],
  "nodes": [
    {
      "id": "prompt",
      "label": "Prompt",
      "caption": "task",
      "position": [
        138,
        315
      ],
      "size": [
        240,
        84
      ],
      "role": "source",
      "icon": "file"
    },
    {
      "id": "candidates",
      "label": "Candidates",
      "caption": "outputs",
      "position": [
        412,
        315
      ],
      "size": [
        240,
        84
      ],
      "role": "agent",
      "icon": "agent"
    },
    {
      "id": "judge",
      "label": "Judge",
      "caption": "rubric",
      "position": [
        688,
        315
      ],
      "size": [
        240,
        84
      ],
      "role": "tool",
      "icon": "shield"
    },
    {
      "id": "report",
      "label": "Report",
      "caption": "scores",
      "position": [
        962,
        315
      ],
      "size": [
        240,
        84
      ],
      "role": "memory",
      "icon": "database"
    },
    {
      "id": "release",
      "label": "Release",
      "caption": "decision",
      "position": [
        1238,
        315
      ],
      "size": [
        240,
        84
      ],
      "role": "output",
      "icon": "output"
    }
  ],
  "edges": [
    {
      "from": "prompt",
      "to": "candidates",
      "label": "eval",
      "role": "process",
      "route": "straight",
      "animated": true,
      "effect": {
        "preset": "packet-flow"
      }
    },
    {
      "from": "candidates",
      "to": "judge",
      "label": "eval",
      "role": "process",
      "route": "straight",
      "animated": true,
      "effect": {
        "preset": "packet-flow"
      }
    },
    {
      "from": "judge",
      "to": "report",
      "label": "eval",
      "role": "process",
      "route": "straight",
      "animated": true,
      "effect": {
        "preset": "packet-flow"
      }
    },
    {
      "from": "report",
      "to": "release",
      "label": "eval",
      "role": "process",
      "route": "straight",
      "animated": true,
      "effect": {
        "preset": "packet-flow"
      }
    }
  ],
  "composition_policy": "composition-v1",
  "icon_system": "illustrated",
  "layout": "pipeline",
  "resolved_presentation": {
    "icon_system": {
      "value": "illustrated",
      "source": "default",
      "version": "2.5.0"
    },
    "style": {
      "value": "openai-minimal",
      "source": "explicit"
    },
    "layout": {
      "value": "pipeline",
      "source": "explicit"
    },
    "motion": {
      "value": "showcase-v1",
      "source": "default"
    }
  },
  "motion_policy": {
    "profile": "unrestricted",
    "motion_area": "unrestricted",
    "pulse_mode": "all"
  }
}
