{
  "version": "0.4",
  "canvas": {
    "width": 1632,
    "height": 720
  },
  "style": "minimal-light",
  "title": {
    "text": "Human-in-the-loop Approval Flow",
    "subtitle": "user, agent, reviewer, and system each own a clear lane"
  },
  "motion": {
    "profile": "showcase-v1",
    "sequence": "staged",
    "ease": "spring",
    "stagger": 0.12,
    "duration_scale": 1.0,
    "intensity": 1.0,
    "edge": {
      "preset": "packet-flow"
    },
    "node": {
      "preset": "icon-performance"
    },
    "group": {
      "preset": "border-scan"
    },
    "title": {
      "preset": "highlight-sweep"
    },
    "reduced_motion": "subtle"
  },
  "groups": [
    {
      "id": "user",
      "label": "User",
      "bounds": [
        75,
        145,
        1375,
        100
      ],
      "role": "actor"
    },
    {
      "id": "agent",
      "label": "Agent",
      "bounds": [
        75,
        285,
        1375,
        100
      ],
      "role": "agent"
    },
    {
      "id": "reviewer",
      "label": "Reviewer",
      "bounds": [
        75,
        425,
        1375,
        100
      ],
      "role": "risk"
    }
  ],
  "nodes": [
    {
      "id": "request",
      "label": "Request",
      "caption": "submit",
      "position": [
        138,
        175
      ],
      "size": [
        240,
        84
      ],
      "role": "actor",
      "icon": "agent"
    },
    {
      "id": "draft",
      "label": "Draft",
      "caption": "agent proposal",
      "position": [
        438,
        315
      ],
      "size": [
        240,
        84
      ],
      "role": "agent",
      "icon": "file"
    },
    {
      "id": "review",
      "label": "Review",
      "caption": "human check",
      "position": [
        738,
        455
      ],
      "size": [
        240,
        84
      ],
      "role": "risk",
      "icon": "shield"
    },
    {
      "id": "approve",
      "label": "Approve",
      "caption": "decision",
      "position": [
        1038,
        455
      ],
      "size": [
        240,
        84
      ],
      "role": "output",
      "icon": "output"
    },
    {
      "id": "execute",
      "label": "Execute",
      "caption": "system action",
      "position": [
        1038,
        315
      ],
      "size": [
        240,
        84
      ],
      "role": "tool",
      "icon": "api"
    },
    {
      "id": "notify",
      "label": "Notify",
      "caption": "result",
      "position": [
        1288,
        175
      ],
      "size": [
        240,
        84
      ],
      "role": "output",
      "icon": "output"
    }
  ],
  "edges": [
    {
      "from": "request",
      "to": "draft",
      "label": "handoff",
      "role": "process",
      "route": "orthogonal",
      "animated": true,
      "effect": {
        "preset": "packet-flow"
      }
    },
    {
      "from": "draft",
      "to": "review",
      "label": "handoff",
      "role": "process",
      "route": "orthogonal",
      "animated": true,
      "effect": {
        "preset": "packet-flow"
      }
    },
    {
      "from": "review",
      "to": "approve",
      "label": "handoff",
      "role": "process",
      "route": "orthogonal",
      "animated": true,
      "effect": {
        "preset": "packet-flow"
      }
    },
    {
      "from": "approve",
      "to": "execute",
      "label": "handoff",
      "role": "process",
      "route": "orthogonal",
      "animated": true,
      "effect": {
        "preset": "packet-flow"
      }
    },
    {
      "from": "execute",
      "to": "notify",
      "label": "handoff",
      "role": "process",
      "route": "orthogonal",
      "animated": true,
      "effect": {
        "preset": "packet-flow"
      }
    }
  ],
  "composition_policy": "composition-v1",
  "icon_system": "illustrated",
  "layout": "swimlane",
  "resolved_presentation": {
    "icon_system": {
      "value": "illustrated",
      "source": "default",
      "version": "2.5.0"
    },
    "style": {
      "value": "minimal-light",
      "source": "explicit"
    },
    "layout": {
      "value": "swimlane",
      "source": "explicit"
    },
    "motion": {
      "value": "showcase-v1",
      "source": "default"
    }
  },
  "motion_policy": {
    "profile": "unrestricted",
    "motion_area": "unrestricted",
    "pulse_mode": "all"
  },
  "preset": "swimlane"
}
