{
  "version": "0.4",
  "canvas": {
    "width": 1632,
    "height": 720
  },
  "style": "blueprint",
  "title": {
    "text": "MCP Server Architecture",
    "subtitle": "client requests route through tools, resources, auth, and transport"
  },
  "motion": {
    "profile": "showcase-v1",
    "sequence": "staged",
    "ease": "spring",
    "stagger": 0.12,
    "duration_scale": 1.0,
    "intensity": 1.0,
    "edge": {
      "preset": "packet-flow"
    },
    "node": {
      "preset": "icon-performance"
    },
    "group": {
      "preset": "border-scan"
    },
    "title": {
      "preset": "highlight-sweep"
    },
    "reduced_motion": "subtle"
  },
  "groups": [
    {
      "id": "client-plane",
      "label": "Client Plane",
      "bounds": [
        75,
        225,
        562,
        195
      ],
      "role": "source"
    },
    {
      "id": "server-plane",
      "label": "Server Plane",
      "bounds": [
        612,
        140,
        819,
        365
      ],
      "role": "agent"
    }
  ],
  "nodes": [
    {
      "id": "client",
      "label": "Client",
      "caption": "LLM host",
      "position": [
        112,
        300
      ],
      "size": [
        240,
        84
      ],
      "role": "actor",
      "icon": "agent"
    },
    {
      "id": "transport",
      "label": "Transport",
      "caption": "stdio / http",
      "position": [
        375,
        300
      ],
      "size": [
        240,
        84
      ],
      "role": "tool",
      "icon": "api"
    },
    {
      "id": "server",
      "label": "MCP Server",
      "caption": "capability router",
      "position": [
        650,
        300
      ],
      "size": [
        240,
        88
      ],
      "role": "agent",
      "icon": "tool"
    },
    {
      "id": "tools",
      "label": "Tools",
      "caption": "actions",
      "position": [
        969,
        205
      ],
      "size": [
        240,
        84
      ],
      "role": "process",
      "icon": "tool"
    },
    {
      "id": "resources",
      "label": "Resources",
      "caption": "read context",
      "position": [
        969,
        395
      ],
      "size": [
        240,
        84
      ],
      "role": "memory",
      "icon": "folder"
    },
    {
      "id": "policy",
      "label": "Policy",
      "caption": "auth + limits",
      "position": [
        1250,
        300
      ],
      "size": [
        240,
        84
      ],
      "role": "risk",
      "icon": "shield"
    }
  ],
  "edges": [
    {
      "from": "client",
      "to": "transport",
      "label": "request",
      "role": "actor",
      "route": "straight",
      "animated": true,
      "effect": {
        "preset": "packet-flow"
      }
    },
    {
      "from": "transport",
      "to": "server",
      "label": "message",
      "role": "tool",
      "route": "straight",
      "animated": true,
      "effect": {
        "preset": "packet-flow"
      }
    },
    {
      "from": "server",
      "to": "tools",
      "label": "invoke",
      "role": "process",
      "route": "orthogonal",
      "effect": {
        "preset": "packet-flow"
      },
      "animated": true
    },
    {
      "from": "server",
      "to": "resources",
      "label": "read",
      "role": "memory",
      "route": "orthogonal",
      "effect": {
        "preset": "stream-flow"
      },
      "animated": true
    },
    {
      "from": "tools",
      "to": "policy",
      "label": "guard",
      "role": "risk",
      "route": "orthogonal",
      "animated": true,
      "effect": {
        "preset": "packet-flow"
      }
    },
    {
      "from": "resources",
      "to": "policy",
      "label": "scope",
      "role": "risk",
      "route": "orthogonal",
      "animated": true,
      "effect": {
        "preset": "packet-flow"
      }
    }
  ],
  "composition_policy": "composition-v1",
  "icon_system": "illustrated",
  "layout": "layered",
  "resolved_presentation": {
    "icon_system": {
      "value": "illustrated",
      "source": "default",
      "version": "2.5.0"
    },
    "style": {
      "value": "blueprint",
      "source": "explicit"
    },
    "layout": {
      "value": "layered",
      "source": "explicit"
    },
    "motion": {
      "value": "showcase-v1",
      "source": "default"
    }
  },
  "motion_policy": {
    "profile": "unrestricted",
    "motion_area": "unrestricted",
    "pulse_mode": "all"
  }
}
