{
  "version": "0.4",
  "canvas": {
    "width": 1632,
    "height": 720
  },
  "style": "deep-tech",
  "title": {
    "text": "Realtime AI Ops Mesh",
    "subtitle": "signals move through policy, model, and action loops"
  },
  "motion": {
    "profile": "showcase-v1",
    "sequence": "staged",
    "ease": "spring",
    "stagger": 0.12,
    "duration_scale": 1.0,
    "intensity": 1.0,
    "edge": {
      "preset": "packet-flow"
    },
    "node": {
      "preset": "icon-performance"
    },
    "group": {
      "preset": "border-scan"
    },
    "title": {
      "preset": "highlight-sweep"
    },
    "reduced_motion": "subtle"
  },
  "groups": [
    {
      "id": "telemetry",
      "label": "Telemetry",
      "bounds": [
        75,
        150,
        594,
        165
      ],
      "role": "source"
    },
    {
      "id": "runtime",
      "label": "Runtime",
      "bounds": [
        625,
        145,
        800,
        420
      ],
      "role": "agent"
    }
  ],
  "nodes": [
    {
      "id": "signals",
      "label": "Signals",
      "caption": "events",
      "position": [
        112,
        195
      ],
      "size": [
        240,
        84
      ],
      "role": "source",
      "icon": "cloud"
    },
    {
      "id": "stream",
      "label": "Stream",
      "caption": "normalize",
      "position": [
        394,
        195
      ],
      "size": [
        240,
        84
      ],
      "role": "process",
      "icon": "api"
    },
    {
      "id": "agent",
      "label": "Agent",
      "caption": "coordinate",
      "position": [
        675,
        315
      ],
      "size": [
        240,
        92
      ],
      "role": "agent",
      "icon": "agent"
    },
    {
      "id": "model",
      "label": "Model",
      "caption": "score",
      "position": [
        988,
        195
      ],
      "size": [
        240,
        84
      ],
      "role": "tool",
      "icon": "tool"
    },
    {
      "id": "policy",
      "label": "Policy",
      "caption": "guard",
      "position": [
        988,
        445
      ],
      "size": [
        240,
        84
      ],
      "role": "risk",
      "icon": "shield"
    },
    {
      "id": "action",
      "label": "Action",
      "caption": "dispatch",
      "position": [
        1269,
        315
      ],
      "size": [
        240,
        84
      ],
      "role": "output",
      "icon": "output"
    }
  ],
  "edges": [
    {
      "from": "signals",
      "to": "stream",
      "label": "ingest",
      "role": "source",
      "route": "straight",
      "animated": true,
      "effect": {
        "preset": "packet-flow"
      }
    },
    {
      "from": "stream",
      "to": "agent",
      "label": "context",
      "role": "process",
      "route": "orthogonal",
      "animated": true,
      "effect": {
        "preset": "packet-flow"
      }
    },
    {
      "from": "agent",
      "to": "model",
      "label": "score",
      "role": "tool",
      "route": "orthogonal",
      "effect": {
        "preset": "packet-flow"
      },
      "animated": true
    },
    {
      "from": "agent",
      "to": "policy",
      "label": "check",
      "role": "risk",
      "route": "orthogonal",
      "effect": {
        "preset": "stream-flow"
      },
      "animated": true
    },
    {
      "from": "model",
      "to": "action",
      "label": "pass",
      "role": "output",
      "route": "orthogonal",
      "animated": true,
      "effect": {
        "preset": "packet-flow"
      }
    },
    {
      "from": "policy",
      "to": "action",
      "label": "approve",
      "role": "output",
      "route": "orthogonal",
      "animated": true,
      "effect": {
        "preset": "packet-flow"
      }
    }
  ],
  "composition_policy": "composition-v1",
  "icon_system": "illustrated",
  "layout": "network",
  "resolved_presentation": {
    "icon_system": {
      "value": "illustrated",
      "source": "default",
      "version": "2.5.0"
    },
    "style": {
      "value": "deep-tech",
      "source": "explicit"
    },
    "layout": {
      "value": "network",
      "source": "explicit"
    },
    "motion": {
      "value": "showcase-v1",
      "source": "default"
    }
  },
  "motion_policy": {
    "profile": "unrestricted",
    "motion_area": "unrestricted",
    "pulse_mode": "all"
  }
}
